{
  "baseline_id": "ibm-cics-ts-6x-task-enqueue-2026-09-13",
  "book_href": "SSJL4D_6.x/reference-applications/commands-api/dfhp4_enq.html",
  "book_label": "CICS task enqueue semantic slice",
  "content_url_template": "https://www.ibm.com/docs/api/v1/content/{topic_path}?parsebody=true&lang=en",
  "coverage_credit": 0,
  "product": "SSJL4D_6.x",
  "retained_in_repository": false,
  "schema_version": "mainframe-env.topic-manifest@1",
  "snapshot_date": "2026-09-13",
  "subsystem": "cics",
  "target_subsystem": "cics.application-api",
  "toc_sha256": "f65c51e52facc390c05f084e1d249ff19e68bf2d7f8d3f32d4d745faf622681a",
  "toc_url": "https://www.ibm.com/docs/api/v1/toc/cics-ts/6.x?lang=en",
  "topic_count": 5,
  "topic_manifest_digest": "227d3f8ca1df29d60f1ee3fc33ee3ff89e6c172fd0e40311989bc573adbd0287",
  "topic_manifest_digest_definition": "sha256 over the concatenation, sorted by topic_path, of one \"<topic_path> <sha256>\\n\" line per topic, each <sha256> written as bare lowercase hex",
  "topics": [
    {
      "bytes": 18521,
      "last_modified": "2026-08-26",
      "sha256": "09c89c6001943ab36a0a331db9fae0db13d3a7ce6962ce9ea21acd0795fa9353",
      "topic_path": "SSJL4D_6.x/reference-applications/commands-api/dfhp4_deq.html"
    },
    {
      "bytes": 25480,
      "last_modified": "2026-08-26",
      "sha256": "5c7bdcd1e3bdae56f3b786e5d60d1d90a83f987e94d70f2cfd1b7b0932a611ee",
      "topic_path": "SSJL4D_6.x/reference-applications/commands-api/dfhp4_enq.html"
    },
    {
      "bytes": 26202,
      "last_modified": "2026-01-16",
      "sha256": "0b996b8c9ddaeb10cc92d8031d9e970ac026b249f548a2e0c87b35e14973e322",
      "topic_path": "SSJL4D_6.x/reference-system-management/resources/enqmodel/dfha4_summary.html"
    },
    {
      "bytes": 11593,
      "last_modified": "2026-01-16",
      "sha256": "be0e7a8eeeecbc39788d6abd8470c46f5fc109b09d12dcafcd79c6a26f5b13d5",
      "topic_path": "SSJL4D_6.x/reference-system-programming/user-exits/dfha3l3.html"
    },
    {
      "bytes": 8674,
      "last_modified": "2026-05-20",
      "sha256": "190b0b0ab492b284f5ffdba3fb98fb22d729ed48c0ab58dd1f30d4d1688a29ac",
      "topic_path": "SSJL4D_6.x/tuning/dfht3rc.html"
    }
  ],
  "total_bytes": 90470
}
