{
  "schema_version": "mainframe-env.topic-manifest@1",
  "target_subsystem": "ims.programming",
  "baseline_id": "ibm-ims-15.6-q-deq-contracts-2026-09-11",
  "subsystem": "ims",
  "product": "SSEPH2_15.6.0",
  "book_label": "IMS 15.6 Q and DEQ archive supplement for mainframe-env 0.14",
  "book_href": "SSEPH2_15.6.0/com.ibm.ims156.doc.apr/ims_qcmdcode.htm",
  "snapshot_date": "2026-09-11",
  "toc_url": "https://www.ibm.com/docs/api/v1/toc/ims/15.6.0?lang=en",
  "toc_sha256": "aaa12586b41e9994921bfddce588b186dc5bdda8ab253db054ae1e5014d6f618",
  "content_url_template": "https://www.ibm.com/docs/api/v1/content/{topic_path}?parsebody=true&lang=en",
  "topic_count": 4,
  "total_bytes": 33499,
  "topic_manifest_digest_definition": "sha256 over the concatenation, sorted by topic_path, of one \"<topic_path> <sha256>\\n\" line per topic, each <sha256> written as bare lowercase hex",
  "topic_manifest_digest": "c9347102caea79a553387ea26b65ecd1a97b03ac0fd8d6874c442df110a0a5f4",
  "coverage_credit": 0,
  "retained_in_repository": false,
  "topics": [
    {
      "topic_path": "SSEPH2_15.6.0/com.ibm.ims156.doc.apg/ims_reservingsegments.htm",
      "sha256": "4d3967707752564dcc2193e8003341bfdd63a2a2d5358ba8d5f9db210830fbbe",
      "bytes": 3791,
      "last_modified": "not-recorded-in-retained-archive"
    },
    {
      "topic_path": "SSEPH2_15.6.0/com.ibm.ims156.doc.apr/ims_deqcall.htm",
      "sha256": "ece3fcc632ba0b1cfa68836d8ab30cadf8081afbdb7d626ef26cc4d337728990",
      "bytes": 17885,
      "last_modified": "not-recorded-in-retained-archive"
    },
    {
      "topic_path": "SSEPH2_15.6.0/com.ibm.ims156.doc.apr/ims_qcmdcode.htm",
      "sha256": "e5af5bd0b7a2a631e0db6600fc0464428bda15cb1d5364b74cfe5fc7b8559eae",
      "bytes": 9960,
      "last_modified": "not-recorded-in-retained-archive"
    },
    {
      "topic_path": "SSEPH2_15.6.0/com.ibm.ims156.doc.dag/ims_lockqcommand.htm",
      "sha256": "e9127601febd8f76a8e5a36d3f761ac62be74dcbd67deefb2ed3c45aabe92f2d",
      "bytes": 1863,
      "last_modified": "not-recorded-in-retained-archive"
    }
  ]
}
