{
  "schema_version": "mainframe-env.topic-manifest@1",
  "target_subsystem": "ims.programming",
  "baseline_id": "ibm-ims-15.6-gsam-recovery-2026-09-11",
  "subsystem": "ims",
  "product": "SSEPH2_15.6.0",
  "book_label": "IMS 15.6 GSAM checkpoint/restart source supplement",
  "book_href": "SSEPH2_15.6.0/com.ibm.ims156.doc.apg/ims_gsamsymbolicchkpandxrst.htm",
  "snapshot_date": "2026-09-11",
  "toc_url": "https://www.ibm.com/docs/api/v1/toc/ims/15.6.0?lang=en",
  "toc_sha256": "aaa12586b41e9994921bfddce588b186dc5bdda8ab253db054ae1e5014d6f618",
  "content_url_template": "https://www.ibm.com/docs/api/v1/content/{topic_path}?parsebody=true&lang=en",
  "topic_count": 1,
  "total_bytes": 4372,
  "topic_manifest_digest_definition": "sha256 over the concatenation, sorted by topic_path, of one \"<topic_path> <sha256>\\n\" line per topic, each <sha256> written as bare lowercase hex",
  "topic_manifest_digest": "5957b8e2a868c0fc8db7d379630af868b048fe9a3dd86fd8466c4de664bd2353",
  "coverage_credit": 0,
  "retained_in_repository": false,
  "topics": [
    {
      "topic_path": "SSEPH2_15.6.0/com.ibm.ims156.doc.apg/ims_gsamsymbolicchkpandxrst.htm",
      "sha256": "ebc695770a487c4fd3b9b06fa0d6948353a1f6543c75e29ec45e94048066616c",
      "bytes": 4372,
      "last_modified": "not-recorded-in-retained-archive"
    }
  ]
}
